name,website,description,context
Seattle Coffee Works,https://coffee-rank.com/best-coffee-shops-in-seattle/,"Offers in-house espresso, pour-overs, non-cafe drinks, and a slow bar menu.",Identified as a top coffee shop in Seattle for 2025.
Elm Coffee Roasters,https://wanderlog.com/list/geoCategory/17877/best-coffee-shops-and-best-cafes-in-seattle,A coffee roaster with a shop in Pioneer Square and a coffee bar in a South Lake Union office building.,Featured in a list of the 50 best coffee shops and cafes in Seattle.
Street Bean Coffee Roasters,https://de.pinterest.com/seattleunexplored/best-seattle-coffee-shops/,A coffee roasting business located in the Belltown neighborhood of Seattle.,Specific business mentioned within a curated review of Seattle coffee shops.
Starbucks (7th Avenue),https://yandex.com/maps/org/starbucks/190070937699/,A specific location of the coffee chain situated on 7th Avenue in Seattle.,Direct business listing including contact details and working hours.
Victrola Coffee Roasters,https://mycoffeeexplorer.com/guides/seattle,A highly rated coffee shop (4.5 out of 5) and notable roaster in Seattle.,Ranked as the best coffee shop in Seattle by the My Coffee Explorer 2026 guide.
Espresso Vivace,https://mycoffeeexplorer.com/guides/seattle,A notable coffee roaster recognized for its contribution to the Seattle coffee scene.,Listed as a key roaster in a guide to the best coffee in Seattle.
Seattle's Best Coffee,https://www.amazon.com/Seattles-Best-Coffee-Organic-12-Ounce/dp/B01N9TN82B,"Coffee brand offering organic, dark roasted blends like the 6th Avenue Bistro Fair Trade Organic.",Specific business and product listing for a Seattle-based coffee company.
Mt Si Coffee Roaster,https://www.menupix.com/seattle/restaurants/250943634/Mt-Si-Coffee-Roaster-Sammamish-WA,A coffee roaster and restaurant located in the Sammamish/Seattle area.,Direct business menu listing found in a Seattle restaurant directory.
Mercurys Coffee Co.,https://www.menupix.com/seattle/restaurants/250943634/Mt-Si-Coffee-Roaster-Sammamish-WA,A coffee shop and beverage provider in the Seattle metropolitan area.,Listed as a relevant coffee shop within a local business directory.
Tra Tea & Juice Bar,https://www.menupix.com/seattle/restaurants/250943634/Mt-Si-Coffee-Roaster-Sammamish-WA,"An establishment serving juice, smoothies, and coffee.",Included in a directory of coffee and tea shops in the Seattle area.
Sammamish Cafe,https://www.menupix.com/seattle/restaurants/250943634/Mt-Si-Coffee-Roaster-Sammamish-WA,"An American diner and cafe offering breakfast, brunch, and coffee.",Identified as a local cafe/restaurant in a Seattle-area directory.
Distant Worlds Coffeehouse,https://twitter.com/dw_seattle?lang=ru,"A woman-owned, LGBTQ and BIPOC safe gathering ground for geeks, offering coffee and online ordering.",Direct social media profile and business description for a Seattle-based coffeehouse.
